{
  "schema_id": "infinium.evaluation.fixture-public-manifest/v1",
  "schema_version": "1",
  "fixture_id": "BETH-NPC-DEV",
  "fixture_version": "1.4.0",
  "evaluation_ids": [
    "EVAL-0052",
    "EVAL-0086"
  ],
  "purpose": "Qualify project-authored NPC, race, override, winner, FormKey, field, link, and bounded taxonomy evidence for later Slice 4 evaluation.",
  "classification": "boundary",
  "partition": "development",
  "partition_history": [
    {
      "from": null,
      "to": "development",
      "at": "2026-08-01T22:00:00.0000000+00:00",
      "reason": "Corrected successor to fixture version 1.0.0 after the Slice 4 Mutagen conformance probe exposed a fixture-structure error.",
      "change_influenced_implementation": true
    }
  ],
  "taxonomy_id": "infinium.skyrim-se.mod-impact-taxonomy",
  "taxonomy_version": "0.1.0",
  "input_package_fingerprint": "1312d91f7e223018180dc88b673ec1e65e45a0e622e44d2660be64204e681ec4",
  "oracle_fingerprint": "afaef185be2d9cfb4b1f246c35683ac78d3b4bc3cc1a0477de00e8672a83c20a",
  "provenance_fingerprint": "586e9edb95ef643602872f471c253038cae20b6f727bc965033bb1034e4c4a03",
  "replay_dependency_fingerprint": "8d7b55d99f6c101fcb6f7306e46d693ee376e2a52c5b036d57dcd709b9a5487b",
  "redistribution_class": "project-authored-redistributable",
  "owner": "infinium-evaluation",
  "review_state": "accepted",
  "created_at": "2026-08-02T20:00:00.0000000+00:00"
}
