{
  "schema_id": "infinium.evaluation.fixture-public-manifest/v1",
  "schema_version": "1",
  "fixture_id": "M1-PLAT-SLICE2-SUBSTRATE-v1",
  "fixture_version": "1.0.0",
  "evaluation_ids": [
    "EVAL-0026",
    "EVAL-0038",
    "EVAL-0079",
    "EVAL-0080",
    "EVAL-0087",
    "EVAL-0088"
  ],
  "purpose": "Exercise the accepted M1 Slice 2 lifecycle, lineage, write-safety, persistence, and local IPC substrate without semantic answers or real installation data.",
  "classification": "boundary",
  "partition": "development",
  "partition_history": [
    {
      "from": null,
      "to": "development",
      "at": "2026-07-29T00:00:00.0000000+00:00",
      "reason": "Initial registration of the project-authored Slice 2 substrate fixture.",
      "change_influenced_implementation": false
    }
  ],
  "taxonomy_id": "infinium.skyrim-se.mod-impact-taxonomy",
  "taxonomy_version": "0.1.0",
  "input_package_fingerprint": "7d3392f374e4fd8e2f1f923c83e8850756f2e95a990dfcb27f288745833b387b",
  "oracle_fingerprint": "3a0437107cdf99af3bf4f014fd3af11ce61a3e69e0c65169309be449672b3e82",
  "provenance_fingerprint": "37bb5b544bc81124b6e9faf18988868bdf5ec12de17207307509af83891168a0",
  "replay_dependency_fingerprint": "9beb94b89d2b10270996133327d6e71cef9637fba22b1cf4896779050416bb4c",
  "redistribution_class": "project-authored",
  "owner": "infinium-evaluation",
  "review_state": "accepted",
  "created_at": "2026-07-29T00:00:00.0000000+00:00"
}
