{
  "schema_id": "infinium.evaluation.fixture-public-manifest/v1",
  "schema_version": "1",
  "fixture_id": "CAND-WP3-SCALE-VAL-v1",
  "fixture_version": "1.0.0",
  "evaluation_ids": [
    "EVAL-0032",
    "EVAL-0065",
    "EVAL-0067",
    "EVAL-0082"
  ],
  "purpose": "Small validation-scale expansion with exact independently enumerated semantic population and membership below the 64 MiB aggregate boundary.",
  "classification": "boundary",
  "partition": "validation",
  "partition_history": [
    {
      "from": null,
      "to": "validation",
      "at": "2026-08-09T06:20:47.5665585+00:00",
      "reason": "Pre-registered from accepted public authority before any product comparison.",
      "change_influenced_implementation": false
    }
  ],
  "taxonomy_id": "infinium.skyrim-se.mod-impact-taxonomy",
  "taxonomy_version": "0.1.0",
  "input_package_fingerprint": "3b0bcc7ad4807b1bc527df340375f8b4028cc4c3540210f1cd6b2ba743822431",
  "oracle_fingerprint": "0c62947fe9e9d3ee185262bd87ad512f0708d6387769607c4e5225829ae62f8c",
  "provenance_fingerprint": "51c6cf82699b926df5fd969daeab27fb2f2501d8264a635e13b8b90dc5d635c1",
  "replay_dependency_fingerprint": "422b546a05aee3f3053726eee6ef1a03ae1af67be56413e62a56368900af3604",
  "redistribution_class": "project-authored-redistributable",
  "owner": "codex.product-blind.wp3.fixture-author.20260809",
  "review_state": "sealed",
  "created_at": "2026-08-09T06:20:47.5665585+00:00"
}
