{
  "schema_id": "infinium.evaluation.fixture-public-manifest/v1",
  "schema_version": "1",
  "fixture_id": "BETH-REFR-DEV",
  "fixture_version": "1.3.0",
  "evaluation_ids": [
    "EVAL-0052",
    "EVAL-0086"
  ],
  "purpose": "Qualify project-authored placed-reference, relation, placement, override, winner, FormKey, boundary, and bounded taxonomy evidence for later Slice 4 evaluation.",
  "classification": "boundary",
  "partition": "development",
  "partition_history": [
    {
      "from": null,
      "to": "development",
      "at": "2026-08-01T22:00:00.0000000+00:00",
      "reason": "Corrected successor to fixture version 1.0.0 after the Slice 4 Mutagen conformance probe exposed a fixture-structure error.",
      "change_influenced_implementation": true
    }
  ],
  "taxonomy_id": "infinium.skyrim-se.mod-impact-taxonomy",
  "taxonomy_version": "0.1.0",
  "input_package_fingerprint": "a8410d5bd8616f26034746cf5911930c7ab289bd38ec48fe3f45bde46395d58e",
  "oracle_fingerprint": "d9f3f634faf4725d6feaa260931584f4ecebf00973570ae19b90a096cbcd91bb",
  "provenance_fingerprint": "f63f33c162631f57e85413b5b18351d3a251aca26ca5552a11f393ace2f48699",
  "replay_dependency_fingerprint": "08752d7c5159376d48cfe10784f2a9d1e0c680a01ef24f62bc665a37846eb199",
  "redistribution_class": "project-authored-redistributable",
  "owner": "infinium-evaluation",
  "review_state": "accepted",
  "created_at": "2026-08-02T20:00:00.0000000+00:00"
}
