{
  "schema_id": "infinium.evaluation.fixture-public-manifest/v1",
  "schema_version": "1",
  "fixture_id": "CAND-WP3-STRESS-DEV-v1",
  "fixture_version": "1.0.0",
  "evaluation_ids": [
    "EVAL-0032",
    "EVAL-0065",
    "EVAL-0067",
    "EVAL-0082"
  ],
  "purpose": "Development stress expansion using the same recipe as validation scale, proved by independent streaming counts and a length-framed SHA-256 factual receipt without aggregate materialization.",
  "classification": "boundary",
  "partition": "development",
  "partition_history": [
    {
      "from": null,
      "to": "development",
      "at": "2026-08-09T06:20:47.5665585+00:00",
      "reason": "Pre-registered from accepted public authority before any product comparison.",
      "change_influenced_implementation": false
    }
  ],
  "taxonomy_id": "infinium.skyrim-se.mod-impact-taxonomy",
  "taxonomy_version": "0.1.0",
  "input_package_fingerprint": "f2b445883b2050daa75be1902800f0c2d42a8f0cfd777742aebf24f7186d4eed",
  "oracle_fingerprint": "3e0dcce7b1c8d220c4dc693a79eafee2cae6f06cde461717f891d5724dd7e703",
  "provenance_fingerprint": "c3b06f8b3d3ab680fde87d4b8205c9df388be327c9d4debe2f28d453e7f017fd",
  "replay_dependency_fingerprint": "de5265aea6860eb087e82f8b0309b19b5e0770bdef604881c0ada0ae3a9d9148",
  "redistribution_class": "project-authored-redistributable",
  "owner": "codex.product-blind.wp3.fixture-author.20260809",
  "review_state": "sealed",
  "created_at": "2026-08-09T06:20:47.5665585+00:00"
}
