{
  "schema_id": "infinium.evaluation.fixture-public-manifest/v1",
  "schema_version": "1",
  "fixture_id": "BETH-LIGHT-VAL",
  "fixture_version": "1.4.0",
  "evaluation_ids": [
    "EVAL-0052"
  ],
  "purpose": "Qualify project-authored full, light, ESL-flagged, maximum, and invalid local-identity boundaries for later Slice 4 evaluation.",
  "classification": "boundary",
  "partition": "development",
  "partition_history": [
    {
      "from": null,
      "to": "validation",
      "at": "2026-07-30T18:00:00.0000000+00:00",
      "reason": "Initial registration before the answer-bearing package entered ordinary implementation context.",
      "change_influenced_implementation": false
    },
    {
      "from": "validation",
      "to": "development",
      "at": "2026-08-01T18:00:00.0000000+00:00",
      "reason": "Owner-approved correction: public answer exposure makes this package development evidence under ADR-0026.",
      "change_influenced_implementation": true,
      "replacement_fixture_id": "BETH-LIGHT-VAL-002",
      "replacement_partition": "validation",
      "replacement_input_package_fingerprint": "b0f756bb402d0305401ef3ee90017cbbe24e56fc34f7343bbd74e0c49ac1e69d",
      "replacement_oracle_fingerprint": "e704d9f587985f8e10d83428521023736e679f211ecb1daae51793913c64f705",
      "independence_evidence_reference": {
        "artifact_id": "beth-light-val-002-independence-evidence",
        "artifact_version": "1.0.0",
        "fingerprint": "56e8c202f1ce9fcee560935219e6eb10af9842c70f278af7bf0b0de1c8928cbb",
        "availability": "evaluator-private"
      },
      "authorized_by": "project-owner/user-directed-adr-0026-private-store-migration"
    }
  ],
  "taxonomy_id": "infinium.skyrim-se.mod-impact-taxonomy",
  "taxonomy_version": "0.1.0",
  "input_package_fingerprint": "b998cf6c4a3bf894e768658bc6f5eca46f9dfc5d46a8554a335ecb4869ba1c23",
  "oracle_fingerprint": "cad37a9af54c1a2cf380caf96b9fdd390a47a5723f1d8adf7d199d07c3740aa2",
  "provenance_fingerprint": "0aca33445b5ddf900e2ce6a888f176ce9d79ce0cdba3c679068e26bf8ae1c62c",
  "replay_dependency_fingerprint": "5b3eabd5a9020b34937292c6022ed60375a1e55b0ceba1e74036f78c8b197c79",
  "redistribution_class": "project-authored-redistributable",
  "owner": "infinium-evaluation",
  "review_state": "accepted",
  "created_at": "2026-08-02T20:00:00.0000000+00:00"
}
